OPERATOR:,right are you able can can you hear the sirens,none,GTIRT17-00567,2017-06-14 01:36:23,2017-06-14 02:06:56,343
CALLER:,yes hello,none,GTIRT17-00567,2017-06-14 01:36:23,2017-06-14 02:06:56,343
OPERATOR:,hello can you hear the sirens,none,GTIRT17-00567,2017-06-14 01:36:23,2017-06-14 02:06:56,343
CALLER:,sirens i can t hear any siren,none,GTIRT17-00567,2017-06-14 01:36:23,2017-06-14 02:06:56,343
OPERATOR:,you can t hear any sirens there are over twenty fire engines,none,GTIRT17-00567,2017-06-14 01:36:23,2017-06-14 02:06:56,343
CALLER:,maybe already alive how many people crowded for the outside of the building so many people,none,GTIRT17-00567,2017-06-14 01:36:23,2017-06-14 02:06:56,343
OPERATOR:,there s a lot of people outside,none,GTIRT17-00567,2017-06-14 01:36:23,2017-06-14 02:06:56,343
CALLER:,so many people outside i think they maybe escape,none,GTIRT17-00567,2017-06-14 01:36:23,2017-06-14 02:06:56,343
OPERATOR:,are there lights can you see the flashing lights,none,GTIRT17-00567,2017-06-14 01:36:23,2017-06-14 02:06:56,343
CALLER:,i can t hear,none,GTIRT17-00567,2017-06-14 01:36:23,2017-06-14 02:06:56,343
OPERATOR:,there should be a lot of flashing blue lights outside your building now cos they do they do know you re there,none,GTIRT17-00567,2017-06-14 01:36:23,2017-06-14 02:06:56,343
CALLER:,i look outside and er i can see the piece of thing fallings down falling down so many piece of the and the ash,Fire,GTIRT17-00567,2017-06-14 01:36:23,2017-06-14 02:06:56,343
OPERATOR:,oh you re right the ash is is the fire upstairs is it,none,GTIRT17-00567,2017-06-14 01:36:23,2017-06-14 02:06:56,343
CALLER:,er yeah i think so,none,GTIRT17-00567,2017-06-14 01:36:23,2017-06-14 02:06:56,343
OPERATOR:,right okay is it what s the part of the flat like now is it is it still hot or is it okay,none,GTIRT17-00567,2017-06-14 01:36:23,2017-06-14 02:06:56,343
CALLER:,i think my no above and a little bit next to flat five,none,GTIRT17-00567,2017-06-14 01:36:23,2017-06-14 02:06:56,343
OPERATOR:,right okay so it s a few floors above you is it,none,GTIRT17-00567,2017-06-14 01:36:23,2017-06-14 02:06:56,343
CALLER:,i heard six times big explosion six times and big er you know inaudible,none,GTIRT17-00567,2017-06-14 01:36:23,2017-06-14 02:06:56,343
OPERATOR:,it might just be to do with like gas pipes or anything like that don t worry,none,GTIRT17-00567,2017-06-14 01:36:23,2017-06-14 02:06:56,343
CALLER:,could you is everyone okay fire office coming in the door,none,GTIRT17-00567,2017-06-14 01:36:23,2017-06-14 02:06:56,343
OPERATOR:,right are you all are you all in the same room,none,GTIRT17-00567,2017-06-14 01:36:23,2017-06-14 02:06:56,343
CALLER:,yes i i am,none,GTIRT17-00567,2017-06-14 01:36:23,2017-06-14 02:06:56,343
OPERATOR:,you re you re all in the same room okay what s the smoke like in the property now is it is it okay have you blocked it out,Smoke,GTIRT17-00567,2017-06-14 01:36:23,2017-06-14 02:06:56,343
CALLER:,oh but it s starting for like smoke inside the room,Smoke,GTIRT17-00567,2017-06-14 01:36:23,2017-06-14 02:06:56,343
OPERATOR:,are you able have you have you blocked up the doorway with er,none,GTIRT17-00567,2017-06-14 01:36:23,2017-06-14 02:06:56,343
CALLER:,no i i will check the downfloors the living door door and maybe yes yeah that s it why don t you inaudible honey don t worry about it it s fine baby inaudible,none,GTIRT17-00567,2017-06-14 01:36:23,2017-06-14 02:06:56,343
OPERATOR:,do you know about flat nine got persons inside flat nine,Flat,GTIRT17-00567,2017-06-14 01:36:23,2017-06-14 02:06:56,343
CALLER:,how many fire inaudible and the people die,none,GTIRT17-00567,2017-06-14 01:36:23,2017-06-14 02:06:56,343
OPERATOR:,i ve got i ve got five in flat nine wheelchair user right we re just updating the fire crews now,Flat,GTIRT17-00567,2017-06-14 01:36:23,2017-06-14 02:06:56,343
CALLER:,thank you so much,none,GTIRT17-00567,2017-06-14 01:36:23,2017-06-14 02:06:56,343
OPERATOR:,it s okay are you all all right,none,GTIRT17-00567,2017-06-14 01:36:23,2017-06-14 02:06:56,343
CALLER:,yes yes all okay,none,GTIRT17-00567,2017-06-14 01:36:23,2017-06-14 02:06:56,343
OPERATOR:,you re all okay oh they already know all right we ve just been told there s twenty five fire engines at your building,none,GTIRT17-00567,2017-06-14 01:36:23,2017-06-14 02:06:56,343
CALLER:,oh thank you so much,none,GTIRT17-00567,2017-06-14 01:36:23,2017-06-14 02:06:56,343
OPERATOR:,so there ll be there ll be some firefighters coming to get you they do know you re there,none,GTIRT17-00567,2017-06-14 01:36:23,2017-06-14 02:06:56,343
CALLER:,inaudible,none,GTIRT17-00567,2017-06-14 01:36:23,2017-06-14 02:06:56,343
OPERATOR:,are you okay,none,GTIRT17-00567,2017-06-14 01:36:23,2017-06-14 02:06:56,343
CALLER:,yes yes sorry my children are inaudible with a health condition as well and the middle one and that s why a bit,none,GTIRT17-00567,2017-06-14 01:36:23,2017-06-14 02:06:56,343
OPERATOR:,yeah i m sure it s quite frightening for them as well,none,GTIRT17-00567,2017-06-14 01:36:23,2017-06-14 02:06:56,343
CALLER:,inaudible and the inhaler kind of thing inaudible now i think my best to do is to oh it s all orange colour now,Fire,GTIRT17-00567,2017-06-14 01:36:23,2017-06-14 02:06:56,343
OPERATOR:,you think there s a fire in your bedroom,Fire,GTIRT17-00567,2017-06-14 01:36:23,2017-06-14 02:06:56,343
CALLER:,no no no outside very bad all the colours shaded for room all orange colour i m gonna shut the door now so best to do,Fire,GTIRT17-00567,2017-06-14 01:36:23,2017-06-14 02:06:56,343
OPERATOR:,yeah shut the door,none,GTIRT17-00567,2017-06-14 01:36:23,2017-06-14 02:06:56,343
CALLER:,i m going to shut that door,none,GTIRT17-00567,2017-06-14 01:36:23,2017-06-14 02:06:56,343
OPERATOR:,there s definitely no fire in your bedroom,Fire,GTIRT17-00567,2017-06-14 01:36:23,2017-06-14 02:06:56,343
CALLER:,no no no all orange colourfor the room yeah in the orange and outside i can t see anything all smoke and i can t see this house anything,Fire,GTIRT17-00567,2017-06-14 01:36:23,2017-06-14 02:06:56,343
OPERATOR:,you the the crews are there i do i promise you there are firefighters there,none,GTIRT17-00567,2017-06-14 01:36:23,2017-06-14 02:06:56,343
CALLER:,inaudible shefind inaudible i can go out inaudible,none,GTIRT17-00567,2017-06-14 01:36:23,2017-06-14 02:06:56,343
OPERATOR:,hello,none,GTIRT17-00567,2017-06-14 01:36:23,2017-06-14 02:06:56,343
CALLER:,hello,none,GTIRT17-00567,2017-06-14 01:36:23,2017-06-14 02:06:56,343
OPERATOR:,hi are you all right are you still there,none,GTIRT17-00567,2017-06-14 01:36:23,2017-06-14 02:06:56,343
CALLER:,yes oh my god inaudible,none,GTIRT17-00567,2017-06-14 01:36:23,2017-06-14 02:06:56,343
OPERATOR:,hello,none,GTIRT17-00567,2017-06-14 01:36:23,2017-06-14 02:06:56,343
CALLER:,hi sorry about this accidentally touched it sorry,none,GTIRT17-00567,2017-06-14 01:36:23,2017-06-14 02:06:56,343
OPERATOR:,it s okay do you need me to go or do you want me to stay,none,GTIRT17-00567,2017-06-14 01:36:23,2017-06-14 02:06:56,343
CALLER:,i hope someone come to rescue us,none,GTIRT17-00567,2017-06-14 01:36:23,2017-06-14 02:06:56,343
OPERATOR:,they do know you re there i promise you they do know,none,GTIRT17-00567,2017-06-14 01:36:23,2017-06-14 02:06:56,343
CALLER:,inaudible parts falling down big big fire start to fall,Fire,GTIRT17-00567,2017-06-14 01:36:23,2017-06-14 02:06:56,343
OPERATOR:,so you re in you re in flat nine,Flat,GTIRT17-00567,2017-06-14 01:36:23,2017-06-14 02:06:56,343
CALLER:,flat nine,Flat,GTIRT17-00567,2017-06-14 01:36:23,2017-06-14 02:06:56,343
OPERATOR:,and you re on the third floor,Flat,GTIRT17-00567,2017-06-14 01:36:23,2017-06-14 02:06:56,343
CALLER:,yeah i can see,none,GTIRT17-00567,2017-06-14 01:36:23,2017-06-14 02:06:56,343
OPERATOR:,they do know you re there i promise,none,GTIRT17-00567,2017-06-14 01:36:23,2017-06-14 02:06:56,343
CALLER:,oh okay i don t have confidence now i can t go down stairs it coming i m sad i can t walk well i can t,none,GTIRT17-00567,2017-06-14 01:36:23,2017-06-14 02:06:56,343
OPERATOR:,okay okay don t worry the crew i promise you the crews do know you re there,none,GTIRT17-00567,2017-06-14 01:36:23,2017-06-14 02:06:56,343
CALLER:,i can t i can t go down the stair,none,GTIRT17-00567,2017-06-14 01:36:23,2017-06-14 02:06:56,343
OPERATOR:,you can t get down the stairs don t worry don t worry,none,GTIRT17-00567,2017-06-14 01:36:23,2017-06-14 02:06:56,343
CALLER:,i can t i can t my children can t you know children inaudible,People,GTIRT17-00567,2017-06-14 01:36:23,2017-06-14 02:06:56,343
OPERATOR:,is there any is there any smoke coming into your flat,Smoke,GTIRT17-00567,2017-06-14 01:36:23,2017-06-14 02:06:56,343
CALLER:,children me and the children have to inaudible either my children stay with me they can walk run away but me i can t,none,GTIRT17-00567,2017-06-14 01:36:23,2017-06-14 02:06:56,343
OPERATOR:,no if it s not safe i don t want you to leave the flat,none,GTIRT17-00567,2017-06-14 01:36:23,2017-06-14 02:06:56,343
CALLER:,i can t walk at all i can see so many big piece falling down,none,GTIRT17-00567,2017-06-14 01:36:23,2017-06-14 02:06:56,343
OPERATOR:,i need you to stay calm for me can you can you do that,none,GTIRT17-00567,2017-06-14 01:36:23,2017-06-14 02:06:56,343
CALLER:,yes yes thank you,none,GTIRT17-00567,2017-06-14 01:36:23,2017-06-14 02:06:56,343
OPERATOR:,who s who s the other adult in the in the property,People,GTIRT17-00567,2017-06-14 01:36:23,2017-06-14 02:06:56,343
CALLER:,inaudible,none,GTIRT17-00567,2017-06-14 01:36:23,2017-06-14 02:06:56,343
OPERATOR:,i just need you to stay calm for me,none,GTIRT17-00567,2017-06-14 01:36:23,2017-06-14 02:06:56,343
CALLER:,i sorry crying,none,GTIRT17-00567,2017-06-14 01:36:23,2017-06-14 02:06:56,343
OPERATOR:,there are twenty five fire engines outside your building i promise you they know you re there,none,GTIRT17-00567,2017-06-14 01:36:23,2017-06-14 02:06:56,343
CALLER:,oh yeah yeah oh i can see through the inaudible out of the window,none,GTIRT17-00567,2017-06-14 01:36:23,2017-06-14 02:06:56,343
OPERATOR:,what is it what is it you can see,none,GTIRT17-00567,2017-06-14 01:36:23,2017-06-14 02:06:56,343
CALLER:,i can see much distance all the smoke and the broke away from the outside,none,GTIRT17-00567,2017-06-14 01:36:23,2017-06-14 02:06:56,343
OPERATOR:,so you can is it like sort of ash ash and stuff you can see coming out of the windows,none,GTIRT17-00567,2017-06-14 01:36:23,2017-06-14 02:06:56,343
CALLER:,yeah i can see that you know fire things you know fly over basically i can see all the smoke and the orange colour,Fire,GTIRT17-00567,2017-06-14 01:36:23,2017-06-14 02:06:56,343
OPERATOR:,it will is there any smoke inside your flat,Smoke,GTIRT17-00567,2017-06-14 01:36:23,2017-06-14 02:06:56,343
CALLER:,yeah i have smoke,Smoke,GTIRT17-00567,2017-06-14 01:36:23,2017-06-14 02:06:56,343
OPERATOR:,you ve got some smoke in the flat,Smoke,GTIRT17-00567,2017-06-14 01:36:23,2017-06-14 02:06:56,343
CALLER:,and the smoke yeah and now i have one side of the window i try to open and get the fresh air now other wise i can feel it inside the smell quite bad it come through the entrance,Smoke,GTIRT17-00567,2017-06-14 01:36:23,2017-06-14 02:06:56,343
OPERATOR:,it will smell quite bad are you able have you blocked up the doorways the gaps under the bottom of the door,none,GTIRT17-00567,2017-06-14 01:36:23,2017-06-14 02:06:56,343
CALLER:,yeah yes we,none,GTIRT17-00567,2017-06-14 01:36:23,2017-06-14 02:06:56,343
OPERATOR:,have you blocked them up with some bedding or,none,GTIRT17-00567,2017-06-14 01:36:23,2017-06-14 02:06:56,343
CALLER:,yeah yes i did i did,none,GTIRT17-00567,2017-06-14 01:36:23,2017-06-14 02:06:56,343
OPERATOR:,yeah are you can you get as far away from the door as you can into another room,none,GTIRT17-00567,2017-06-14 01:36:23,2017-06-14 02:06:56,343
CALLER:,i have no i have one living room only and the inaudible i can see the smoke and the,Smoke,GTIRT17-00567,2017-06-14 01:36:23,2017-06-14 02:06:56,343
OPERATOR:,i know,none,GTIRT17-00567,2017-06-14 01:36:23,2017-06-14 02:06:56,343
CALLER:,and the fire falling on the inaudible,Fire,GTIRT17-00567,2017-06-14 01:36:23,2017-06-14 02:06:56,343
OPERATOR:,i just need you to stay calm for me you re doing really well,none,GTIRT17-00567,2017-06-14 01:36:23,2017-06-14 02:06:56,343
CALLER:,inaudible to cry,none,GTIRT17-00567,2017-06-14 01:36:23,2017-06-14 02:06:56,343
OPERATOR:,it s okay that s fine the crews do know you re there i promise,none,GTIRT17-00567,2017-06-14 01:36:23,2017-06-14 02:06:56,343
CALLER:,could you please inaudible you have to go inaudible okay hi,none,GTIRT17-00567,2017-06-14 01:36:23,2017-06-14 02:06:56,343
OPERATOR:,are you okay,none,GTIRT17-00567,2017-06-14 01:36:23,2017-06-14 02:06:56,343
CALLER:,yeah inaudible otherwise no one recognise,none,GTIRT17-00567,2017-06-14 01:36:23,2017-06-14 02:06:56,343
OPERATOR:,they do know you re there i promise they do know tell him the fire engine is coming there s twenty five fire engines outside can you see the fire engines now all right can you speak to me then,none,GTIRT17-00567,2017-06-14 01:36:23,2017-06-14 02:06:56,343
CALLER:,i m here sorry yes sorry i m here,none,GTIRT17-00567,2017-06-14 01:36:23,2017-06-14 02:06:56,343
OPERATOR:,it s okay can you see the fire engines now,none,GTIRT17-00567,2017-06-14 01:36:23,2017-06-14 02:06:56,343
CALLER:,i can see fireman and er and er also above there s some helicopters there,none,GTIRT17-00567,2017-06-14 01:36:23,2017-06-14 02:06:56,343
OPERATOR:,right so you can see the fire crews,none,GTIRT17-00567,2017-06-14 01:36:23,2017-06-14 02:06:56,343
CALLER:,you re burning,none,GTIRT17-00567,2017-06-14 01:36:23,2017-06-14 02:06:56,343
OPERATOR:,but you can you can see them yeah,none,GTIRT17-00567,2017-06-14 01:36:23,2017-06-14 02:06:56,343
CALLER:,inaudible,none,GTIRT17-00567,2017-06-14 01:36:23,2017-06-14 02:06:56,343
OPERATOR:,it s okay you re doing really well,none,GTIRT17-00567,2017-06-14 01:36:23,2017-06-14 02:06:56,343
CALLER:,oh thank you thank you thank you,none,GTIRT17-00567,2017-06-14 01:36:23,2017-06-14 02:06:56,343
OPERATOR:,are you okay,none,GTIRT17-00567,2017-06-14 01:36:23,2017-06-14 02:06:56,343
CALLER:,yes sorry i inaudible children inaudible,People,GTIRT17-00567,2017-06-14 01:36:23,2017-06-14 02:06:56,343
OPERATOR:,oh right okay can you hear anybody outside the flat any crews any firefighters,none,GTIRT17-00567,2017-06-14 01:36:23,2017-06-14 02:06:56,343
CALLER:,sorry,none,GTIRT17-00567,2017-06-14 01:36:23,2017-06-14 02:06:56,343
OPERATOR:,can you hear any of the firefighters outside,none,GTIRT17-00567,2017-06-14 01:36:23,2017-06-14 02:06:56,343
CALLER:,yeah i can see i can see firefighter outside,none,GTIRT17-00567,2017-06-14 01:36:23,2017-06-14 02:06:56,343
OPERATOR:,right they do know you re there i promise they do,none,GTIRT17-00567,2017-06-14 01:36:23,2017-06-14 02:06:56,343
CALLER:,thank you so much,none,GTIRT17-00567,2017-06-14 01:36:23,2017-06-14 02:06:56,343
OPERATOR:,they know that there s five there s five of you in flat nine and you re on the third floor,Flat,GTIRT17-00567,2017-06-14 01:36:23,2017-06-14 02:06:56,343
CALLER:,yes i am,none,GTIRT17-00567,2017-06-14 01:36:23,2017-06-14 02:06:56,343
OPERATOR:,is that right,none,GTIRT17-00567,2017-06-14 01:36:23,2017-06-14 02:06:56,343
CALLER:,yes ma am thank you so much for the support,none,GTIRT17-00567,2017-06-14 01:36:23,2017-06-14 02:06:56,343
OPERATOR:,they know they know that you need a wheelchair as well,none,GTIRT17-00567,2017-06-14 01:36:23,2017-06-14 02:06:56,343
CALLER:,inaudible you know children and inaudible,People,GTIRT17-00567,2017-06-14 01:36:23,2017-06-14 02:06:56,343
OPERATOR:,are they okay are the children okay,People,GTIRT17-00567,2017-06-14 01:36:23,2017-06-14 02:06:56,343
CALLER:,yes children are fine but you know they know i can t go downstairs,People,GTIRT17-00567,2017-06-14 01:36:23,2017-06-14 02:06:56,343
OPERATOR:,it s okay the crews the crews know that you you need some help getting down the stairs,none,GTIRT17-00567,2017-06-14 01:36:23,2017-06-14 02:06:56,343
CALLER:,it s just the just the children are basically worrying they notice i can t go downstairs,People,GTIRT17-00567,2017-06-14 01:36:23,2017-06-14 02:06:56,343
OPERATOR:,okay tell em not to worry that the fire crews will get you out don t worry,none,GTIRT17-00567,2017-06-14 01:36:23,2017-06-14 02:06:56,343
CALLER:,oh thank you thank you so much for your help,none,GTIRT17-00567,2017-06-14 01:36:23,2017-06-14 02:06:56,343
OPERATOR:,it s okay it s okay cos what they ve got to do is they ve got to check the flats on each floor so they will get to you,none,GTIRT17-00567,2017-06-14 01:36:23,2017-06-14 02:06:56,343
CALLER:,i am okay i am okay in the door,none,GTIRT17-00567,2017-06-14 01:36:23,2017-06-14 02:06:56,343
OPERATOR:,are they knocking,none,GTIRT17-00567,2017-06-14 01:36:23,2017-06-14 02:06:56,343
CALLER:,hold on hold on someone knocking someone knocking,none,GTIRT17-00567,2017-06-14 01:36:23,2017-06-14 02:06:56,343
OPERATOR:,someone knocking right okay that ll be the fire crews,none,GTIRT17-00567,2017-06-14 01:36:23,2017-06-14 02:06:56,343
CALLER:,mummy going mummy going hold on fireman came sorry,People,GTIRT17-00567,2017-06-14 01:36:23,2017-06-14 02:06:56,343
OPERATOR:,okay all right goon i m glad you re safe bye bye,none,GTIRT17-00567,2017-06-14 01:36:23,2017-06-14 02:06:56,343
OPERATOR:,fire brigade,none,GTIRT17-00569,2017-06-14 01:54:14,2017-06-14 02:34:14,474
CALLER:,sir please help us it s getting worse we re in the ninety five s people are inaudible on the landings i don t know what to do i ve got two young children in here,Flat,GTIRT17-00569,2017-06-14 01:54:14,2017-06-14 02:34:14,474
OPERATOR:,right you re on the twelfth floor,Fire,GTIRT17-00569,2017-06-14 01:54:14,2017-06-14 02:34:14,474
CALLER:,yes please send overspeaking,none,GTIRT17-00569,2017-06-14 01:54:14,2017-06-14 02:34:14,474
OPERATOR:,yeah i was speaking overspeaking i ve already let the crews know exactly where you are okay we re getting to you as quick as we can are you still inside your flat,none,GTIRT17-00569,2017-06-14 01:54:14,2017-06-14 02:34:14,474
CALLER:,yeah can you tell them to come for me now because everyone is leaving it s getting it s banging and everything it s corn i can hear it on my wall next door please i can hear the fire on the wall next door from the kitchen,none,GTIRT17-00569,2017-06-14 01:54:14,2017-06-14 02:34:14,474
OPERATOR:,right see in the corridor is there smoke in your main corridor is it bad,none,GTIRT17-00569,2017-06-14 01:54:14,2017-06-14 02:34:14,474
CALLER:,yeah the whole flat the whole flat it s black,Smoke,GTIRT17-00569,2017-06-14 01:54:14,2017-06-14 02:34:14,474
OPERATOR:,okay but outside your flat is there heavy smoke there would you be able to get to another flat is there anybody,none,GTIRT17-00569,2017-06-14 01:54:14,2017-06-14 02:34:14,474
CALLER:,no no it s black out there i ve heard people on the inaudible outside on the landing screaming now,none,GTIRT17-00569,2017-06-14 01:54:14,2017-06-14 02:34:14,474
OPERATOR:,what s gone on what was the banging,none,GTIRT17-00569,2017-06-14 01:54:14,2017-06-14 02:34:14,474
CALLER:,it s coming in the window now it s burning our windows it s like an explosion or something,Fire,GTIRT17-00569,2017-06-14 01:54:14,2017-06-14 02:34:14,474
OPERATOR:,yeah we re going to get to you as soon as we can,none,GTIRT17-00569,2017-06-14 01:54:14,2017-06-14 02:34:14,474
CALLER:,can t you send them now,none,GTIRT17-00569,2017-06-14 01:54:14,2017-06-14 02:34:14,474
OPERATOR:,yeah inaudible four,none,GTIRT17-00569,2017-06-14 01:54:14,2017-06-14 02:34:14,474
CALLER:,no we re in twelfth please number twelfth floor,Floor,GTIRT17-00569,2017-06-14 01:54:14,2017-06-14 02:34:14,474
OPERATOR:,yeah i know where you are you re on the twelfth floor,Floor,GTIRT17-00569,2017-06-14 01:54:14,2017-06-14 02:34:14,474
CALLER:,yeah but there s a fire next door on the twelfth floor we re gonna be burnt,Fire,GTIRT17-00569,2017-06-14 01:54:14,2017-06-14 02:34:14,474
OPERATOR:,yeah i know there s a fire in flat ninety six and you re in flat number ninety five,Flat,GTIRT17-00569,2017-06-14 01:54:14,2017-06-14 02:34:14,474
CALLER:,yeah but they re not putting it out they re putting out the one downstairs,none,GTIRT17-00569,2017-06-14 01:54:14,2017-06-14 02:34:14,474
OPERATOR:,okay but we ve made them aware that there s a fire on the twelfth floor as well,Floor,GTIRT17-00569,2017-06-14 01:54:14,2017-06-14 02:34:14,474
CALLER:,please tell them to come to me sir i just want to get out my kids please,People,GTIRT17-00569,2017-06-14 01:54:14,2017-06-14 02:34:14,474
OPERATOR:,okay are you staying down low below the smoke,Smoke,GTIRT17-00569,2017-06-14 01:54:14,2017-06-14 02:34:14,474
CALLER:,i can hear it on my walls burning,Fire,GTIRT17-00569,2017-06-14 01:54:14,2017-06-14 02:34:14,474
OPERATOR:,yeah are you staying low below the smoke,none,GTIRT17-00569,2017-06-14 01:54:14,2017-06-14 02:34:14,474
CALLER:,yeah i m low but i ve got to keep checking the room the fire s not in the flat in the flat oh the wall s are boiling hot please sir there s two,Fire,GTIRT17-00569,2017-06-14 01:54:14,2017-06-14 02:34:14,474
OPERATOR:,yeah okay right are you in the room furthest away,none,GTIRT17-00569,2017-06-14 01:54:14,2017-06-14 02:34:14,474
CALLER:,yeah but i ve got to keep checking the room near the front door because,none,GTIRT17-00569,2017-06-14 01:54:14,2017-06-14 02:34:14,474
OPERATOR:,okay right well we ve got firefighters,none,GTIRT17-00569,2017-06-14 01:54:14,2017-06-14 02:34:14,474
CALLER:,overspeaking it s on the landing,Fire,GTIRT17-00569,2017-06-14 01:54:14,2017-06-14 02:34:14,474
OPERATOR:,what s on the landing,none,GTIRT17-00569,2017-06-14 01:54:14,2017-06-14 02:34:14,474
CALLER:,it s outside please please it s outside my door please,Fire,GTIRT17-00569,2017-06-14 01:54:14,2017-06-14 02:34:14,474
OPERATOR:,right the fire is outside your door now,Fire,GTIRT17-00569,2017-06-14 01:54:14,2017-06-14 02:34:14,474
CALLER:,yes yes please,none,GTIRT17-00569,2017-06-14 01:54:14,2017-06-14 02:34:14,474
OPERATOR:,okay right we re coming to you as soon as we can okay we ve got firefighters coming up to you,none,GTIRT17-00569,2017-06-14 01:54:14,2017-06-14 02:34:14,474
CALLER:,oh please send them now,none,GTIRT17-00569,2017-06-14 01:54:14,2017-06-14 02:34:14,474
OPERATOR:,yeah,none,GTIRT17-00569,2017-06-14 01:54:14,2017-06-14 02:34:14,474
CALLER:,i m begging you,none,GTIRT17-00569,2017-06-14 01:54:14,2017-06-14 02:34:14,474
OPERATOR:,yeah so we ve got a lot a lot of firefighters there and they re coming to you right how many children have you got in there with you,People,GTIRT17-00569,2017-06-14 01:54:14,2017-06-14 02:34:14,474
CALLER:,two,People,GTIRT17-00569,2017-06-14 01:54:14,2017-06-14 02:34:14,474
OPERATOR:,two what age are they,People,GTIRT17-00569,2017-06-14 01:54:14,2017-06-14 02:34:14,474
CALLER:,eight and twelve,none,GTIRT17-00569,2017-06-14 01:54:14,2017-06-14 02:34:14,474
OPERATOR:,right how are they,People,GTIRT17-00569,2017-06-14 01:54:14,2017-06-14 02:34:14,474
CALLER:,not good,none,GTIRT17-00569,2017-06-14 01:54:14,2017-06-14 02:34:14,474
OPERATOR:,right are they below the smoke as well are they staying down low,Smoke,GTIRT17-00569,2017-06-14 01:54:14,2017-06-14 02:34:14,474
CALLER:,yeah it s bad we need to get out should i leave will i go down the stairs,none,GTIRT17-00569,2017-06-14 01:54:14,2017-06-14 02:34:14,474
OPERATOR:,okay the fire in your flat is it,Fire,GTIRT17-00569,2017-06-14 01:54:14,2017-06-14 02:34:14,474
CALLER:,yeah overspeaking,none,GTIRT17-00569,2017-06-14 01:54:14,2017-06-14 02:34:14,474
OPERATOR:,overspeaking the window,none,GTIRT17-00569,2017-06-14 01:54:14,2017-06-14 02:34:14,474
CALLER:,yeah i ve got to get out it s outside in the landing i ve got to get out,none,GTIRT17-00569,2017-06-14 01:54:14,2017-06-14 02:34:14,474
OPERATOR:,right where are you gonna go,none,GTIRT17-00569,2017-06-14 01:54:14,2017-06-14 02:34:14,474
CALLER:,into the stairs are they no i can t there s a fire out there please please i m begging you to send someone to me now just to get me me and my daughters to get us to that staircase,People,GTIRT17-00569,2017-06-14 01:54:14,2017-06-14 02:34:14,474
OPERATOR:,yeah okay we re coming to you as quick as we can okay,none,GTIRT17-00569,2017-06-14 01:54:14,2017-06-14 02:34:14,474
CALLER:,oh man no i can t i can t stay in here sir please send them,none,GTIRT17-00569,2017-06-14 01:54:14,2017-06-14 02:34:14,474
OPERATOR:,yeah well i already have i already have they re coming to you as quick as they can,none,GTIRT17-00569,2017-06-14 01:54:14,2017-06-14 02:34:14,474
CALLER:,can you not try again just one more time,none,GTIRT17-00569,2017-06-14 01:54:14,2017-06-14 02:34:14,474
OPERATOR:,yeah i m talking to the people on the radio they re talking to them,none,GTIRT17-00569,2017-06-14 01:54:14,2017-06-14 02:34:14,474
CALLER:,right you told me if it gets worse to call back and i am,none,GTIRT17-00569,2017-06-14 01:54:14,2017-06-14 02:34:14,474
OPERATOR:,sorry,none,GTIRT17-00569,2017-06-14 01:54:14,2017-06-14 02:34:14,474
CALLER:,you told me if it gets worse to call back and i am i need to get out,none,GTIRT17-00569,2017-06-14 01:54:14,2017-06-14 02:34:14,474
OPERATOR:,yeah i know,none,GTIRT17-00569,2017-06-14 01:54:14,2017-06-14 02:34:14,474
CALLER:,i can t,none,GTIRT17-00569,2017-06-14 01:54:14,2017-06-14 02:34:14,474
OPERATOR:,right so you just need to try and keep calm okay we re going to get to you as quick as we can now,none,GTIRT17-00569,2017-06-14 01:54:14,2017-06-14 02:34:14,474
CALLER:,okay overspeaking,none,GTIRT17-00569,2017-06-14 01:54:14,2017-06-14 02:34:14,474
OPERATOR:,can you pyt any can you get a wet cloth and keep it over your mouth,none,GTIRT17-00569,2017-06-14 01:54:14,2017-06-14 02:34:14,474
CALLER:,girls put some wet flannels over your mouth,People,GTIRT17-00569,2017-06-14 01:54:14,2017-06-14 02:34:14,474
