CALLER:,okay but the fire s coming up to the floor what are we going to do when it overspeaking the window,Fire,GTIRT17-00571,2017-06-14 01:54:23,2017-06-14 01:55:42,27
OPERATOR:,just the fire coming through the door,Fire,GTIRT17-00571,2017-06-14 01:54:23,2017-06-14 01:55:42,27
CALLER:,it s going to come through the window in a second,Fire,GTIRT17-00571,2017-06-14 01:54:23,2017-06-14 01:55:42,27
OPERATOR:,oh so is it the er can you people wave from the wi can you see the flames at the window,Fire,GTIRT17-00571,2017-06-14 01:54:23,2017-06-14 01:55:42,27
CALLER:,that s what we ve done we can see the flames yes,Fire,GTIRT17-00571,2017-06-14 01:54:23,2017-06-14 01:55:42,27
OPERATOR:,yeah so i can just let them know that that you re there okay,none,GTIRT17-00571,2017-06-14 01:54:23,2017-06-14 01:55:42,27
CALLER:,they know they know we re here we just need someone to hurry and come,none,GTIRT17-00571,2017-06-14 01:54:23,2017-06-14 01:55:42,27
OPERATOR:,yeah i ll i ll reinforce that for you,none,GTIRT17-00571,2017-06-14 01:54:23,2017-06-14 01:55:42,27
CALLER:,please please,none,GTIRT17-00571,2017-06-14 01:54:23,2017-06-14 01:55:42,27
OPERATOR:,the urgency that s flat two hundred five,Flat,GTIRT17-00571,2017-06-14 01:54:23,2017-06-14 01:55:42,27
CALLER:,please yes,Flat,GTIRT17-00571,2017-06-14 01:54:23,2017-06-14 01:55:42,27
OPERATOR:,flat two hundred five,Flat,GTIRT17-00571,2017-06-14 01:54:23,2017-06-14 01:55:42,27
CALLER:,yeah,none,GTIRT17-00571,2017-06-14 01:54:23,2017-06-14 01:55:42,27
OPERATOR:,yeah what floor,Floor,GTIRT17-00571,2017-06-14 01:54:23,2017-06-14 01:55:42,27
CALLER:,two two twenty third right at the top three,Floor,GTIRT17-00571,2017-06-14 01:54:23,2017-06-14 01:55:42,27
OPERATOR:,the twenty third okay i ll let them know all right,Floor,GTIRT17-00571,2017-06-14 01:54:23,2017-06-14 01:55:42,27
CALLER:,yeah okay please,none,GTIRT17-00571,2017-06-14 01:54:23,2017-06-14 01:55:42,27
OPERATOR:,okay thank you bye bye,none,GTIRT17-00571,2017-06-14 01:54:23,2017-06-14 01:55:42,27
OPERATOR:,fire brigade,none,GTIRT17-00572,2017-06-14 01:56:20,2017-06-14 01:57:40,22
CALLER:,oh hi good evening i think you know about it already we re in grenfell tower the whole tower s on on fire and we re on the nineteenth floor,none,GTIRT17-00572,2017-06-14 01:56:20,2017-06-14 01:57:40,22
OPERATOR:,you re on the nineteenth floor are you,Floor,GTIRT17-00572,2017-06-14 01:56:20,2017-06-14 01:57:40,22
CALLER:,yeah we can t go outside because there s too much smoke and everything,Smoke,GTIRT17-00572,2017-06-14 01:56:20,2017-06-14 01:57:40,22
OPERATOR:,too much smoke no don t go outside what flat are you in please,Flat,GTIRT17-00572,2017-06-14 01:56:20,2017-06-14 01:57:40,22
CALLER:,one hundred sixty five,Flat,GTIRT17-00572,2017-06-14 01:56:20,2017-06-14 01:57:40,22
OPERATOR:,one hundred sixty five and you re on the nineteenth floor yeah,Flat,GTIRT17-00572,2017-06-14 01:56:20,2017-06-14 01:57:40,22
CALLER:,yeah,none,GTIRT17-00572,2017-06-14 01:56:20,2017-06-14 01:57:40,22
OPERATOR:,okay right the fire,none,GTIRT17-00572,2017-06-14 01:56:20,2017-06-14 01:57:40,22
CALLER:,the fire alarm s gone off and the fire brigade are on site and everything else but i just wanted to,none,GTIRT17-00572,2017-06-14 01:56:20,2017-06-14 01:57:40,22
OPERATOR:,yeah no that s all right what i ll do i ll let them know where you are they will becoming door to door to make sure everyone s safe the fire is actually on the fourth floor okay so,none,GTIRT17-00572,2017-06-14 01:56:20,2017-06-14 01:57:40,22
CALLER:,okay,none,GTIRT17-00572,2017-06-14 01:56:20,2017-06-14 01:57:40,22
OPERATOR:,one hundred sixty five okay yeah and,none,GTIRT17-00572,2017-06-14 01:56:20,2017-06-14 01:57:40,22
CALLER:,yeah and i ve got my wife and our dog here,People,GTIRT17-00572,2017-06-14 01:56:20,2017-06-14 01:57:40,22
OPERATOR:,okay what s it like in the flat have you got smoke coming into your flat at all,Smoke,GTIRT17-00572,2017-06-14 01:56:20,2017-06-14 01:57:40,22
CALLER:,yeah there s there s it s only it s only smoke cos i opened the front door and so smoke came in i ve closed the front door it s just in the corridor,Smoke,GTIRT17-00572,2017-06-14 01:56:20,2017-06-14 01:57:40,22
OPERATOR:,okay all right then okay what you can do if you just put some towels blankets overspeaking,none,GTIRT17-00572,2017-06-14 01:56:20,2017-06-14 01:57:40,22
CALLER:,yeah i ve got a towel and,none,GTIRT17-00572,2017-06-14 01:56:20,2017-06-14 01:57:40,22
OPERATOR:,put that s it put them all round the door leave the windows closed cos i know there s a lot of smoke outside as well and they ll make their way up to you okay if anything changes give us a call back okay but yeah stay where you are all right then thank you,Smoke,GTIRT17-00572,2017-06-14 01:56:20,2017-06-14 01:57:40,22
CALLER:,thank you very much,none,GTIRT17-00572,2017-06-14 01:56:20,2017-06-14 01:57:40,22
OPERATOR:,bye bye,none,GTIRT17-00572,2017-06-14 01:56:20,2017-06-14 01:57:40,22
CALLER:,bye,none,GTIRT17-00572,2017-06-14 01:56:20,2017-06-14 01:57:40,22
OPERATOR:,fire brigade,none,GTIRT17-00579,2017-06-14 02:00:33,2017-06-14 02:02:05,31
CALLER:,fire brigade i ve been waiting here fifteen minutes love the flat s worse,none,GTIRT17-00579,2017-06-14 02:00:33,2017-06-14 02:02:05,31
OPERATOR:,twenty second floor,Floor,GTIRT17-00579,2017-06-14 02:00:33,2017-06-14 02:02:05,31
CALLER:,yes i m a pensioner darling i can t get about,People,GTIRT17-00579,2017-06-14 02:00:33,2017-06-14 02:02:05,31
OPERATOR:,okay listen you can t go any where anyway you re in the safest place there all right overspeaking,none,GTIRT17-00579,2017-06-14 02:00:33,2017-06-14 02:02:05,31
CALLER:,darling it s black,Smoke,GTIRT17-00579,2017-06-14 02:00:33,2017-06-14 02:02:05,31
OPERATOR:,listen the fire is on the fourth floor okay are you doing everything you can to get the smoke coming in,none,GTIRT17-00579,2017-06-14 02:00:33,2017-06-14 02:02:05,31
CALLER:,yes yes,none,GTIRT17-00579,2017-06-14 02:00:33,2017-06-14 02:02:05,31
OPERATOR:,you are okay,none,GTIRT17-00579,2017-06-14 02:00:33,2017-06-14 02:02:05,31
CALLER:,my my my letterbox won t close so it s coming through the letterbox,Smoke,GTIRT17-00579,2017-06-14 02:00:33,2017-06-14 02:02:05,31
OPERATOR:,all right well put a towel in,none,GTIRT17-00579,2017-06-14 02:00:33,2017-06-14 02:02:05,31
CALLER:,inaudible put something in it all right thanks all right,none,GTIRT17-00579,2017-06-14 02:00:33,2017-06-14 02:02:05,31
OPERATOR:,yeah put a towel or a tea towel or a cushion or something in it put what ever you can,none,GTIRT17-00579,2017-06-14 02:00:33,2017-06-14 02:02:05,31
CALLER:,all right but please inaudible please please get them up here,none,GTIRT17-00579,2017-06-14 02:00:33,2017-06-14 02:02:05,31
OPERATOR:,we are we are going to get you as quickly as we can what s your flat number,Flat,GTIRT17-00579,2017-06-14 02:00:33,2017-06-14 02:02:05,31
CALLER:,one hundred ninety four,Flat,GTIRT17-00579,2017-06-14 02:00:33,2017-06-14 02:02:05,31
OPERATOR:,one hundred ninety four okay all right then is there a room in the flat that s got less smoke in it,Flat,GTIRT17-00579,2017-06-14 02:00:33,2017-06-14 02:02:05,31
CALLER:,sorry,none,GTIRT17-00579,2017-06-14 02:00:33,2017-06-14 02:02:05,31
OPERATOR:,is there a room in the flat that,none,GTIRT17-00579,2017-06-14 02:00:33,2017-06-14 02:02:05,31
CALLER:,no inaudible the front room is about the best one i suppose,none,GTIRT17-00579,2017-06-14 02:00:33,2017-06-14 02:02:05,31
OPERATOR:,okay well you stay in there,none,GTIRT17-00579,2017-06-14 02:00:33,2017-06-14 02:02:05,31
CALLER:,but if i close myself in the bathroom i won t hear a knocking,none,GTIRT17-00579,2017-06-14 02:00:33,2017-06-14 02:02:05,31
OPERATOR:,don t worry they will come in all right okay they will come in and they will find you,none,GTIRT17-00579,2017-06-14 02:00:33,2017-06-14 02:02:05,31
CALLER:,please love overspeaking,none,GTIRT17-00579,2017-06-14 02:00:33,2017-06-14 02:02:05,31
OPERATOR:,they are they ll get you as soon as they can,none,GTIRT17-00579,2017-06-14 02:00:33,2017-06-14 02:02:05,31
CALLER:,overspeaking black,none,GTIRT17-00579,2017-06-14 02:00:33,2017-06-14 02:02:05,31
OPERATOR:,yeah all right then okay right,none,GTIRT17-00579,2017-06-14 02:00:33,2017-06-14 02:02:05,31
CALLER:,all right all right,none,GTIRT17-00579,2017-06-14 02:00:33,2017-06-14 02:02:05,31
OPERATOR:,take care sit on the floor all right the air will be better if you stay low on the floor,none,GTIRT17-00579,2017-06-14 02:00:33,2017-06-14 02:02:05,31
CALLER:,all right all right thank you,none,GTIRT17-00579,2017-06-14 02:00:33,2017-06-14 02:02:05,31
OPERATOR:,all right then all right then bye bye,none,GTIRT17-00579,2017-06-14 02:00:33,2017-06-14 02:02:05,31
OPERATOR:,fire brigade,none,GTIRT17-00581,2017-06-14 02:02:47,2017-06-14 02:04:38,29
CALLER:,yeah i know you know grenfell tower westeleven i know you know but is there any do you know how long the fire brigade s going to be before they come and take us out,none,GTIRT17-00581,2017-06-14 02:02:47,2017-06-14 02:04:38,29
OPERATOR:,okay so what tell me what flat you re in because we re passing on the messages to the radio,none,GTIRT17-00581,2017-06-14 02:02:47,2017-06-14 02:04:38,29
CALLER:,i m in eight eighty two grenfell tower i ve told you before but i mean i just,Flat,GTIRT17-00581,2017-06-14 02:02:47,2017-06-14 02:04:38,29
OPERATOR:,flat eighty two what floor are you on,Flat,GTIRT17-00581,2017-06-14 02:02:47,2017-06-14 02:04:38,29
CALLER:,yeah i think on the eleventh,Floor,GTIRT17-00581,2017-06-14 02:02:47,2017-06-14 02:04:38,29
OPERATOR:,on the eleventh floor what we re doing is we re passing all the messages over to the crews on the scene and they re going along and they re getting the people out of the flats okay i know it s really scary,none,GTIRT17-00581,2017-06-14 02:02:47,2017-06-14 02:04:38,29
CALLER:,they are yeah,none,GTIRT17-00581,2017-06-14 02:02:47,2017-06-14 02:04:38,29
OPERATOR:,yeah i know it s really scary at the moment but that s about all we can do,none,GTIRT17-00581,2017-06-14 02:02:47,2017-06-14 02:04:38,29
CALLER:,because i can see loads of fire brigade downstairs they don t inaudible i don t know i just overspeaking,none,GTIRT17-00581,2017-06-14 02:02:47,2017-06-14 02:04:38,29
OPERATOR:,yeah overspeaking eighty two on the eleventh floor how many people is it is it just you,Flat,GTIRT17-00581,2017-06-14 02:02:47,2017-06-14 02:04:38,29
CALLER:,three three three two adults and a child yeah two adults and a child,People,GTIRT17-00581,2017-06-14 02:02:47,2017-06-14 02:04:38,29
OPERATOR:,three of you two adults i m going to tell them that on the radio two adults and one child and is there any smoke coming into the property please,People,GTIRT17-00581,2017-06-14 02:02:47,2017-06-14 02:04:38,29
CALLER:,there is just the smoke alarm hasn t gone off yet but i ve just seen you know when we had opened the door before cos we thought the fire brigade was out there,none,GTIRT17-00581,2017-06-14 02:02:47,2017-06-14 02:04:38,29
OPERATOR:,right okay what you need to do then is you need to start thinking about putting some towels at the bottom of the door,none,GTIRT17-00581,2017-06-14 02:02:47,2017-06-14 02:04:38,29
CALLER:,we ve done all that already we ve done all that yeah,none,GTIRT17-00581,2017-06-14 02:02:47,2017-06-14 02:04:38,29
OPERATOR:,you ve done all that and all the windows are closed yeah,none,GTIRT17-00581,2017-06-14 02:02:47,2017-06-14 02:04:38,29
CALLER:,no yeah yeah yeah,none,GTIRT17-00581,2017-06-14 02:02:47,2017-06-14 02:04:38,29
OPERATOR:,right okay and if the smoke does come in obviously just stay stay calm and stay low and i m going to tell them straightaway on the radio okay but they are,Smoke,GTIRT17-00581,2017-06-14 02:02:47,2017-06-14 02:04:38,29
CALLER:,please please please,none,GTIRT17-00581,2017-06-14 02:02:47,2017-06-14 02:04:38,29
OPERATOR:,they are aware okay,none,GTIRT17-00581,2017-06-14 02:02:47,2017-06-14 02:04:38,29
CALLER:,okay i just think it s spreading above my flat that s the only problem now,none,GTIRT17-00581,2017-06-14 02:02:47,2017-06-14 02:04:38,29
OPERATOR:,all right lis listen if the situation gets worse right and you know there is a lot of smoke coming into the property then just ring us straight back,none,GTIRT17-00581,2017-06-14 02:02:47,2017-06-14 02:04:38,29
CALLER:,oh my god yes,none,GTIRT17-00581,2017-06-14 02:02:47,2017-06-14 02:04:38,29
OPERATOR:,hold hold onto the phone don t drop the phone out okay because obviously we re really busy with other people as well but i m just going to tell them that on the radio straightaway okay,none,GTIRT17-00581,2017-06-14 02:02:47,2017-06-14 02:04:38,29
CALLER:,okay okay okay,none,GTIRT17-00581,2017-06-14 02:02:47,2017-06-14 02:04:38,29
OPERATOR:,all right then okay take care,none,GTIRT17-00581,2017-06-14 02:02:47,2017-06-14 02:04:38,29
CALLER:,all right thank you bye bye,none,GTIRT17-00581,2017-06-14 02:02:47,2017-06-14 02:04:38,29
OPERATOR:,all right bye bye bye bye,none,GTIRT17-00581,2017-06-14 02:02:47,2017-06-14 02:04:38,29
OPERATOR:,inaudible,none,GTIRT17-00591,2017-06-14 02:10:33,2017-06-14 02:38:05,327
OPERATOR:,glasgow connecting mobile the call was originally for,none,GTIRT17-00591,2017-06-14 02:10:33,2017-06-14 02:38:05,327
OPERATOR:,okay thank you very much hello caller what s the address,none,GTIRT17-00591,2017-06-14 02:10:33,2017-06-14 02:38:05,327
CALLER:,hello one one hundred thirty three grenfell tower there s a big fire here,none,GTIRT17-00591,2017-06-14 02:10:33,2017-06-14 02:38:05,327
OPERATOR:,grenfell grenfell towers,none,GTIRT17-00591,2017-06-14 02:10:33,2017-06-14 02:38:05,327
CALLER:,grenfell towers yeah there s a big fire,none,GTIRT17-00591,2017-06-14 02:10:33,2017-06-14 02:38:05,327
OPERATOR:,yeah is that in london,none,GTIRT17-00591,2017-06-14 02:10:33,2017-06-14 02:38:05,327
CALLER:,happening here,none,GTIRT17-00591,2017-06-14 02:10:33,2017-06-14 02:38:05,327
OPERATOR:,right we have gota lot of fire engines there at the moment is that your alarm going off,none,GTIRT17-00591,2017-06-14 02:10:33,2017-06-14 02:38:05,327
CALLER:,yes yes we are stuckin the flat but there is so much smoke in the flat,Smoke,GTIRT17-00591,2017-06-14 02:10:33,2017-06-14 02:38:05,327
OPERATOR:,right are you able to block the doors,none,GTIRT17-00591,2017-06-14 02:10:33,2017-06-14 02:38:05,327
CALLER:,we did block the doors but there s still smoke coming in,Smoke,GTIRT17-00591,2017-06-14 02:10:33,2017-06-14 02:38:05,327
OPERATOR:,okay what floor are you on,none,GTIRT17-00591,2017-06-14 02:10:33,2017-06-14 02:38:05,327
CALLER:,er we are on the fifteenth floor one hundred thirty three flat number one hundred thirty three,none,GTIRT17-00591,2017-06-14 02:10:33,2017-06-14 02:38:05,327
OPERATOR:,fifteenth floor flat,none,GTIRT17-00591,2017-06-14 02:10:33,2017-06-14 02:38:05,327
CALLER:,fifteenth one inaudible,none,GTIRT17-00591,2017-06-14 02:10:33,2017-06-14 02:38:05,327
OPERATOR:,give me the flat number again,none,GTIRT17-00591,2017-06-14 02:10:33,2017-06-14 02:38:05,327
CALLER:,one three three,none,GTIRT17-00591,2017-06-14 02:10:33,2017-06-14 02:38:05,327
OPERATOR:,one three three you re on the fifteenth floor one three three,none,GTIRT17-00591,2017-06-14 02:10:33,2017-06-14 02:38:05,327
CALLER:,no sixteenth sixteen one six,none,GTIRT17-00591,2017-06-14 02:10:33,2017-06-14 02:38:05,327
OPERATOR:,sixteenth sixteenth floor,none,GTIRT17-00591,2017-06-14 02:10:33,2017-06-14 02:38:05,327
CALLER:,yeah one six,none,GTIRT17-00591,2017-06-14 02:10:33,2017-06-14 02:38:05,327
OPERATOR:,right can you can you get into a room safely get away from the smoke,none,GTIRT17-00591,2017-06-14 02:10:33,2017-06-14 02:38:05,327
CALLER:,yeah we are in the living room that s the furthest away from the door,none,GTIRT17-00591,2017-06-14 02:10:33,2017-06-14 02:38:05,327
OPERATOR:,that s the furthest away right have you got anything you can block the bottom of your doors with to stop,none,GTIRT17-00591,2017-06-14 02:10:33,2017-06-14 02:38:05,327
CALLER:,we did we did already we wet the cloth and put it underneath the door but the,none,GTIRT17-00591,2017-06-14 02:10:33,2017-06-14 02:38:05,327
OPERATOR:,how many people are how many people are in your flat sir,People,GTIRT17-00591,2017-06-14 02:10:33,2017-06-14 02:38:05,327
CALLER:,me and my wife er,People,GTIRT17-00591,2017-06-14 02:10:33,2017-06-14 02:38:05,327
OPERATOR:,you and your wife two people,People,GTIRT17-00591,2017-06-14 02:10:33,2017-06-14 02:38:05,327
CALLER:,yeah,none,GTIRT17-00591,2017-06-14 02:10:33,2017-06-14 02:38:05,327
OPERATOR:,two people right okay we are in contactwith the fire service in london obviously they ve got lots of fire engines there so we re trying to keep people safe but you know we don t want you to go out into the fire so if you can stop the smoke coming in through the doors that s what you d already done,People,GTIRT17-00591,2017-06-14 02:10:33,2017-06-14 02:38:05,327
CALLER:,yeah,none,GTIRT17-00591,2017-06-14 02:10:33,2017-06-14 02:38:05,327
OPERATOR:,right and is there smoke in the room you are in now,Smoke,GTIRT17-00591,2017-06-14 02:10:33,2017-06-14 02:38:05,327
CALLER:,yeah yeah actually the smoke is getting worse,Smoke,GTIRT17-00591,2017-06-14 02:10:33,2017-06-14 02:38:05,327
OPERATOR:,it s getting worse,none,GTIRT17-00591,2017-06-14 02:10:33,2017-06-14 02:38:05,327
CALLER:,yeah,none,GTIRT17-00591,2017-06-14 02:10:33,2017-06-14 02:38:05,327
OPERATOR:,right is it coming from in the corridors outside or can you not tell,none,GTIRT17-00591,2017-06-14 02:10:33,2017-06-14 02:38:05,327
CALLER:,from the corridor yeah from the corridors,none,GTIRT17-00591,2017-06-14 02:10:33,2017-06-14 02:38:05,327
OPERATOR:,right have you got anything else you can block the side sof the doors with or you know put something,none,GTIRT17-00591,2017-06-14 02:10:33,2017-06-14 02:38:05,327
CALLER:,no nothing nothing we tried we tried it we put as much cloth a wet cloth underneath overspeaking,none,GTIRT17-00591,2017-06-14 02:10:33,2017-06-14 02:38:05,327
OPERATOR:,put as much as you can near the doorthat you can,none,GTIRT17-00591,2017-06-14 02:10:33,2017-06-14 02:38:05,327
CALLER:,yes,none,GTIRT17-00591,2017-06-14 02:10:33,2017-06-14 02:38:05,327
OPERATOR:,okay can you look out the window is it fresh air from your window or can you see the flames from your window,none,GTIRT17-00591,2017-06-14 02:10:33,2017-06-14 02:38:05,327
CALLER:,no no it s still fire coming out there s lots of smoke coming out from the otherside,Fire,GTIRT17-00591,2017-06-14 02:10:33,2017-06-14 02:38:05,327
OPERATOR:,okay so don t open the window or anything like that because that will just make things worse the fire service inaudible we are telling them where you are,none,GTIRT17-00591,2017-06-14 02:10:33,2017-06-14 02:38:05,327
CALLER:,sorry,none,GTIRT17-00591,2017-06-14 02:10:33,2017-06-14 02:38:05,327
OPERATOR:,we are telling the fire brigade where you are you know that you re on the sixteenth floor and they re trying to get to people as soon as possible,none,GTIRT17-00591,2017-06-14 02:10:33,2017-06-14 02:38:05,327
CALLER:,okay,none,GTIRT17-00591,2017-06-14 02:10:33,2017-06-14 02:38:05,327
OPERATOR:,okay can if your smoke the smoke begins to get any worse,none,GTIRT17-00591,2017-06-14 02:10:33,2017-06-14 02:38:05,327
CALLER:,yeah it s get it s worse already it s worse already,none,GTIRT17-00591,2017-06-14 02:10:33,2017-06-14 02:38:05,327
OPERATOR:,right the best position that you can do is be get your face right down near to the floor can you do that you and your wife,People,GTIRT17-00591,2017-06-14 02:10:33,2017-06-14 02:38:05,327
CALLER:,okay yeah we can do that okay,none,GTIRT17-00591,2017-06-14 02:10:33,2017-06-14 02:38:05,327
OPERATOR:,yeah get your face because you put your nose right to the floor,none,GTIRT17-00591,2017-06-14 02:10:33,2017-06-14 02:38:05,327
CALLER:,okay,none,GTIRT17-00591,2017-06-14 02:10:33,2017-06-14 02:38:05,327
OPERATOR:,okay so if you can get your face right down to the floor,none,GTIRT17-00591,2017-06-14 02:10:33,2017-06-14 02:38:05,327
CALLER:,okay,none,GTIRT17-00591,2017-06-14 02:10:33,2017-06-14 02:38:05,327
OPERATOR:,are you doing that for me,none,GTIRT17-00591,2017-06-14 02:10:33,2017-06-14 02:38:05,327
CALLER:,yeah yeah,none,GTIRT17-00591,2017-06-14 02:10:33,2017-06-14 02:38:05,327
OPERATOR:,okay my name s susan what s your name,none,GTIRT17-00591,2017-06-14 02:10:33,2017-06-14 02:38:05,327
CALLER:,sener s e n e r,none,GTIRT17-00591,2017-06-14 02:10:33,2017-06-14 02:38:05,327
OPERATOR:,and what s your wife,People,GTIRT17-00591,2017-06-14 02:10:33,2017-06-14 02:38:05,327
CALLER:,hamife h a m i f,none,GTIRT17-00591,2017-06-14 02:10:33,2017-06-14 02:38:05,327
OPERATOR:,hamif,none,GTIRT17-00591,2017-06-14 02:10:33,2017-06-14 02:38:05,327
CALLER:,hamife,none,GTIRT17-00591,2017-06-14 02:10:33,2017-06-14 02:38:05,327
OPERATOR:,hamifa,none,GTIRT17-00591,2017-06-14 02:10:33,2017-06-14 02:38:05,327
CALLER:,h a m i f e,none,GTIRT17-00591,2017-06-14 02:10:33,2017-06-14 02:38:05,327
OPERATOR:,hamife,none,GTIRT17-00591,2017-06-14 02:10:33,2017-06-14 02:38:05,327
CALLER:,hamife yes,none,GTIRT17-00591,2017-06-14 02:10:33,2017-06-14 02:38:05,327
OPERATOR:,and sener,none,GTIRT17-00591,2017-06-14 02:10:33,2017-06-14 02:38:05,327
CALLER:,yeah,none,GTIRT17-00591,2017-06-14 02:10:33,2017-06-14 02:38:05,327
OPERATOR:,okay all right sener we re gonna do you want to keep talking to me are you okay talking,none,GTIRT17-00591,2017-06-14 02:10:33,2017-06-14 02:38:05,327
CALLER:,yeah but er smoke is getting into my eyes as well,Smoke,GTIRT17-00591,2017-06-14 02:10:33,2017-06-14 02:38:05,327
OPERATOR:,right and you ve done everything you can to block it coming into the room,none,GTIRT17-00591,2017-06-14 02:10:33,2017-06-14 02:38:05,327
CALLER:,yeah yeah we did everything we can to block it and i m not sure where the fire is and i m not sure whether we should run outside we don t want to bum alive here,none,GTIRT17-00591,2017-06-14 02:10:33,2017-06-14 02:38:05,327
OPERATOR:,no i don t know what your policy would be but we re just trying to keep you as safe as possible have you put your hand at the back of the door have you touched the backof the door with the backof your hand quickly can you feel any heat,none,GTIRT17-00591,2017-06-14 02:10:33,2017-06-14 02:38:05,327
CALLER:,i m just going to do that i m just going to the door now,none,GTIRT17-00591,2017-06-14 02:10:33,2017-06-14 02:38:05,327
OPERATOR:,don t burn yourself though but just quickly feel it heat on the door can you feel any,none,GTIRT17-00591,2017-06-14 02:10:33,2017-06-14 02:38:05,327
CALLER:,let me go go there is so much smoke here in the corridors,Smoke,GTIRT17-00591,2017-06-14 02:10:33,2017-06-14 02:38:05,327
OPERATOR:,right you ve not opened the door have you sener,none,GTIRT17-00591,2017-06-14 02:10:33,2017-06-14 02:38:05,327
CALLER:,yeah no no there s so much smoke black smoke black smoke actually they re going we re going back into the living room,Smoke,GTIRT17-00591,2017-06-14 02:10:33,2017-06-14 02:38:05,327
OPERATOR:,are you going back into the room that s the furthest away from the smoke,none,GTIRT17-00591,2017-06-14 02:10:33,2017-06-14 02:38:05,327
CALLER:,yeah yeah we did we did,none,GTIRT17-00591,2017-06-14 02:10:33,2017-06-14 02:38:05,327
OPERATOR:,right and have you blocked up the doorway again now don t,none,GTIRT17-00591,2017-06-14 02:10:33,2017-06-14 02:38:05,327
CALLER:,we did we did but there s smoke still coming in,Smoke,GTIRT17-00591,2017-06-14 02:10:33,2017-06-14 02:38:05,327
OPERATOR:,okay and you can t open the windows because there s fire outside as well is that correct,none,GTIRT17-00591,2017-06-14 02:10:33,2017-06-14 02:38:05,327
CALLER:,yeah yeah yeah that s correct,none,GTIRT17-00591,2017-06-14 02:10:33,2017-06-14 02:38:05,327
OPERATOR:,okay have you got your face right down to the floor you you and,none,GTIRT17-00591,2017-06-14 02:10:33,2017-06-14 02:38:05,327
CALLER:,yeah yeah,none,GTIRT17-00591,2017-06-14 02:10:33,2017-06-14 02:38:05,327
OPERATOR:,we ve got can you see any signs of any fire engines outside,none,GTIRT17-00591,2017-06-14 02:10:33,2017-06-14 02:38:05,327
CALLER:,yeah yeah a lot of them,none,GTIRT17-00591,2017-06-14 02:10:33,2017-06-14 02:38:05,327
OPERATOR:,you can see them,none,GTIRT17-00591,2017-06-14 02:10:33,2017-06-14 02:38:05,327
CALLER:,a lot of them a lot of them a lot of them well hundreds of them police and other emergency services,none,GTIRT17-00591,2017-06-14 02:10:33,2017-06-14 02:38:05,327
OPERATOR:,yeah there are there are a police of firefighters they re all they re all trying to help you get out so we ve told them where you are and that information has been passed over to them so if you can just keep calm try and keep calm as you possibly can and keep your nose right down onto the floor,none,GTIRT17-00591,2017-06-14 02:10:33,2017-06-14 02:38:05,327
CALLER:,sorry,none,GTIRT17-00591,2017-06-14 02:10:33,2017-06-14 02:38:05,327
OPERATOR:,is is there any water in the room that you re in,none,GTIRT17-00591,2017-06-14 02:10:33,2017-06-14 02:38:05,327
CALLER:,yes there is,none,GTIRT17-00591,2017-06-14 02:10:33,2017-06-14 02:38:05,327
OPERATOR:,could you would it make it easier if you wet the towel or a tea towel and just put it over your nose and your mouth,none,GTIRT17-00591,2017-06-14 02:10:33,2017-06-14 02:38:05,327
CALLER:,okay we can do that,none,GTIRT17-00591,2017-06-14 02:10:33,2017-06-14 02:38:05,327
OPERATOR:,that might just help a bit don t don t leave the room and make yourself worse will you don t you know don t go out are you going to try are you going to try that with the towel,none,GTIRT17-00591,2017-06-14 02:10:33,2017-06-14 02:38:05,327
CALLER:,yeah i put the towel around my nose,none,GTIRT17-00591,2017-06-14 02:10:33,2017-06-14 02:38:05,327
OPERATOR:,right and did it make it any easierf or you,none,GTIRT17-00591,2017-06-14 02:10:33,2017-06-14 02:38:05,327
CALLER:,a little bit,none,GTIRT17-00591,2017-06-14 02:10:33,2017-06-14 02:38:05,327
