OPERATOR:,fire brigade hello,none,GTIRT17-00663,2017-06-14 02:49:05,2017-06-14 02:50:36,25
CALLER:,hello yes actually we re still in the flat it s coming down ourside,none,GTIRT17-00663,2017-06-14 02:49:05,2017-06-14 02:50:36,25
OPERATOR:,yeah what flat number are you,Flat,GTIRT17-00663,2017-06-14 02:49:05,2017-06-14 02:50:36,25
CALLER:,one hundred thirty three,Flat,GTIRT17-00663,2017-06-14 02:49:05,2017-06-14 02:50:36,25
OPERATOR:,one hundred thirty three and what floor,Flat,GTIRT17-00663,2017-06-14 02:49:05,2017-06-14 02:50:36,25
CALLER:,sixteen one six,Floor,GTIRT17-00663,2017-06-14 02:49:05,2017-06-14 02:50:36,25
OPERATOR:,one six and how many people are there,People,GTIRT17-00663,2017-06-14 02:49:05,2017-06-14 02:50:36,25
CALLER:,two two of us,People,GTIRT17-00663,2017-06-14 02:49:05,2017-06-14 02:50:36,25
OPERATOR:,what two adults,People,GTIRT17-00663,2017-06-14 02:49:05,2017-06-14 02:50:36,25
CALLER:,me and my wife,People,GTIRT17-00663,2017-06-14 02:49:05,2017-06-14 02:50:36,25
OPERATOR:,right yeah right listen to what i m going to say tell you you need to try and get to yourself outside the property i know there s a lot of smoke so what you need to do is you need to put some towels and some sheets around your head and around your body and put a damp towel around your face and you need to try and get out oft he property together safely,Smoke,GTIRT17-00663,2017-06-14 02:49:05,2017-06-14 02:50:36,25
CALLER:,to the stairs yeah,none,GTIRT17-00663,2017-06-14 02:49:05,2017-06-14 02:50:36,25
OPERATOR:,to the stairs yeah you need to get some damp towels first and some sheets and put them around you and get a damp,none,GTIRT17-00663,2017-06-14 02:49:05,2017-06-14 02:50:36,25
CALLER:,is there is smoke in the stairs,Smoke,GTIRT17-00663,2017-06-14 02:49:05,2017-06-14 02:50:36,25
OPERATOR:,i don t know i can t see but you need to try and get away from where you are safely to try and get outside,none,GTIRT17-00663,2017-06-14 02:49:05,2017-06-14 02:50:36,25
CALLER:,okay,none,GTIRT17-00663,2017-06-14 02:49:05,2017-06-14 02:50:36,25
OPERATOR:,okay there s a lot of firemen about and they re on all different floors so you should be able to once you get outside safely then you should be able to see a fireman and they ll help you down the stairs,none,GTIRT17-00663,2017-06-14 02:49:05,2017-06-14 02:50:36,25
CALLER:,okay okay,none,GTIRT17-00663,2017-06-14 02:49:05,2017-06-14 02:50:36,25
OPERATOR:,okay but you need to move away,none,GTIRT17-00663,2017-06-14 02:49:05,2017-06-14 02:50:36,25
CALLER:,okay i ll try that okay i ll try it,none,GTIRT17-00663,2017-06-14 02:49:05,2017-06-14 02:50:36,25
OPERATOR:,but try that and stay with your wife okay and put some sheets and towels around you first before you go out,People,GTIRT17-00663,2017-06-14 02:49:05,2017-06-14 02:50:36,25
CALLER:,okay,none,GTIRT17-00663,2017-06-14 02:49:05,2017-06-14 02:50:36,25
OPERATOR:,okay,none,GTIRT17-00663,2017-06-14 02:49:05,2017-06-14 02:50:36,25
CALLER:,okay,none,GTIRT17-00663,2017-06-14 02:49:05,2017-06-14 02:50:36,25
OPERATOR:,all right thank you bye bye bye bye,none,GTIRT17-00663,2017-06-14 02:49:05,2017-06-14 02:50:36,25
OPERATOR:,fire brigade,none,GTIRT17-00666,2017-06-14 02:48:22,2017-06-14 02:50:33,29
CALLER:,hello yeah we re stuck in grenfell tower,none,GTIRT17-00666,2017-06-14 02:48:22,2017-06-14 02:50:33,29
OPERATOR:,grenfell tower yeah,none,GTIRT17-00666,2017-06-14 02:48:22,2017-06-14 02:50:33,29
CALLER:,we rein grenfell tower we re on the eighteenth floor and we re stuck in the building and just want somebody to help us inaudible,none,GTIRT17-00666,2017-06-14 02:48:22,2017-06-14 02:50:33,29
OPERATOR:,what you re on the eighteenth floor,Floor,GTIRT17-00666,2017-06-14 02:48:22,2017-06-14 02:50:33,29
CALLER:,pardon,none,GTIRT17-00666,2017-06-14 02:48:22,2017-06-14 02:50:33,29
OPERATOR:,did you say you re on the eighteenth floor,Floor,GTIRT17-00666,2017-06-14 02:48:22,2017-06-14 02:50:33,29
CALLER:,yeah eighteenth floor one hundred fifty three,Flat,GTIRT17-00666,2017-06-14 02:48:22,2017-06-14 02:50:33,29
OPERATOR:,one hundred fifty three okay and what s going on is there a fire in your flat,Flat,GTIRT17-00666,2017-06-14 02:48:22,2017-06-14 02:50:33,29
CALLER:,pardon,none,GTIRT17-00666,2017-06-14 02:48:22,2017-06-14 02:50:33,29
OPERATOR:,is there the fire in your flat,Fire,GTIRT17-00666,2017-06-14 02:48:22,2017-06-14 02:50:33,29
CALLER:,yeah,none,GTIRT17-00666,2017-06-14 02:48:22,2017-06-14 02:50:33,29
OPERATOR:,is it coming into your,none,GTIRT17-00666,2017-06-14 02:48:22,2017-06-14 02:50:33,29
CALLER:,the fire is in one hundred fifty two we re in one hundred fifty three at the moment but could you send someone please,Fire,GTIRT17-00666,2017-06-14 02:48:22,2017-06-14 02:50:33,29
OPERATOR:,okay so it s in the flat next door is it the fire s in the flat next to you,Fire,GTIRT17-00666,2017-06-14 02:48:22,2017-06-14 02:50:33,29
CALLER:,yes,none,GTIRT17-00666,2017-06-14 02:48:22,2017-06-14 02:50:33,29
OPERATOR:,okay listen so is your mum and dad there i can speak to or are you the best person to speak to you,People,GTIRT17-00666,2017-06-14 02:48:22,2017-06-14 02:50:33,29
CALLER:,yeah here s my mum,People,GTIRT17-00666,2017-06-14 02:48:22,2017-06-14 02:50:33,29
OPERATOR:,okay hello,none,GTIRT17-00666,2017-06-14 02:48:22,2017-06-14 02:50:33,29
CALLER:,hello,none,GTIRT17-00666,2017-06-14 02:48:22,2017-06-14 02:50:33,29
OPERATOR:,hello yeah your daughter told me that the fire is in the flat next door is that right,Fire,GTIRT17-00666,2017-06-14 02:48:22,2017-06-14 02:50:33,29
CALLER:,yeah,none,GTIRT17-00666,2017-06-14 02:48:22,2017-06-14 02:50:33,29
OPERATOR:,listen you,none,GTIRT17-00666,2017-06-14 02:48:22,2017-06-14 02:50:33,29
CALLER:,i called in and someone said they re severalinaudiblewords to let them know that inaudible there s four overspeaking,none,GTIRT17-00666,2017-06-14 02:48:22,2017-06-14 02:50:33,29
OPERATOR:,okay well listen we re if the fire s in the flat next door you re going to have to leave okay you re going to have to make your way,Fire,GTIRT17-00666,2017-06-14 02:48:22,2017-06-14 02:50:33,29
CALLER:,where we re on the eighteenth floor,Floor,GTIRT17-00666,2017-06-14 02:48:22,2017-06-14 02:50:33,29
OPERATOR:,okay,none,GTIRT17-00666,2017-06-14 02:48:22,2017-06-14 02:50:33,29
CALLER:,inaudible thick black smoke,Smoke,GTIRT17-00666,2017-06-14 02:48:22,2017-06-14 02:50:33,29
OPERATOR:,i know listen we re not going to be able to get up there to you you need to leave the flat and get out what now you need to listen to me very carefully what you need to do you need to get some wet towels and towels put them around your mouth so you won t inhale the smoke and you need to get out okay make your way down don t use the lift use the stairwells okay but you need to put wet blankets and that around your mouth and the kids as well okay and make your way downstairs if the fire s in the flat next door if that s what s going on okay do you understand,Smoke,GTIRT17-00666,2017-06-14 02:48:22,2017-06-14 02:50:33,29
OPERATOR:,hello fire brigade,none,GTIRT17-00675,2017-06-14 02:51:09,2017-06-14 02:56:41,87
CALLER:,hello it s from grenfell tower we need your advice now,none,GTIRT17-00675,2017-06-14 02:51:09,2017-06-14 02:56:41,87
OPERATOR:,okay what s going on,none,GTIRT17-00675,2017-06-14 02:51:09,2017-06-14 02:56:41,87
CALLER:,we are having fire and,Fire,GTIRT17-00675,2017-06-14 02:51:09,2017-06-14 02:56:41,87
OPERATOR:,are you in grenfell tower yeah,none,GTIRT17-00675,2017-06-14 02:51:09,2017-06-14 02:56:41,87
CALLER:,yes we are in nineteen one hundred ninety three,Flat,GTIRT17-00675,2017-06-14 02:51:09,2017-06-14 02:56:41,87
OPERATOR:,one hundred ninety three,Flat,GTIRT17-00675,2017-06-14 02:51:09,2017-06-14 02:56:41,87
CALLER:,and we want to know if we need to if we need to run downstairs or where to go,none,GTIRT17-00675,2017-06-14 02:51:09,2017-06-14 02:56:41,87
OPERATOR:,okay so tell me what tell me what s going on explain to me what what the inaudible like there,none,GTIRT17-00675,2017-06-14 02:51:09,2017-06-14 02:56:41,87
CALLER:,it s it s fire everywhere in the building,Fire,GTIRT17-00675,2017-06-14 02:51:09,2017-06-14 02:56:41,87
OPERATOR:,everywhere in the building so would it be safer for you,none,GTIRT17-00675,2017-06-14 02:51:09,2017-06-14 02:56:41,87
CALLER:,and it s very smoky in the room,Smoke,GTIRT17-00675,2017-06-14 02:51:09,2017-06-14 02:56:41,87
OPERATOR:,to make your way out or to stay where you are i can t see you need to decide that for yourself,none,GTIRT17-00675,2017-06-14 02:51:09,2017-06-14 02:56:41,87
CALLER:,it s very smoky outside it s very smoky outside,Smoke,GTIRT17-00675,2017-06-14 02:51:09,2017-06-14 02:56:41,87
OPERATOR:,is there any flames,Fire,GTIRT17-00675,2017-06-14 02:51:09,2017-06-14 02:56:41,87
CALLER:,everywhere is smoke,Smoke,GTIRT17-00675,2017-06-14 02:51:09,2017-06-14 02:56:41,87
OPERATOR:,okay listen you can do one of two things you can either make your way into a room and shut the door keep the smoke out and stay low or you can try and make your way out of the building,Smoke,GTIRT17-00675,2017-06-14 02:51:09,2017-06-14 02:56:41,87
CALLER:,yeah but overspeaking,none,GTIRT17-00675,2017-06-14 02:51:09,2017-06-14 02:56:41,87
OPERATOR:,listen hello,none,GTIRT17-00675,2017-06-14 02:51:09,2017-06-14 02:56:41,87
CALLER:,we can t go downstairs,none,GTIRT17-00675,2017-06-14 02:51:09,2017-06-14 02:56:41,87
OPERATOR:,hello overspeaking,none,GTIRT17-00675,2017-06-14 02:51:09,2017-06-14 02:56:41,87
CALLER:,overspeaking,none,GTIRT17-00675,2017-06-14 02:51:09,2017-06-14 02:56:41,87
OPERATOR:,hello,none,GTIRT17-00675,2017-06-14 02:51:09,2017-06-14 02:56:41,87
CALLER:,hello can you tell us like what to do,none,GTIRT17-00675,2017-06-14 02:51:09,2017-06-14 02:56:41,87
OPERATOR:,hello overspeaking listen if you re going to try and make your way out you want to cover yourself with wet towels anything like that just cover yourself in wet blankets just make sure it s wet you need to tell me what you re going to do,none,GTIRT17-00675,2017-06-14 02:51:09,2017-06-14 02:56:41,87
CALLER:,overspeaking stay in here please please inaudible,none,GTIRT17-00675,2017-06-14 02:51:09,2017-06-14 02:56:41,87
OPERATOR:,who s that who s that in there with you hello,none,GTIRT17-00675,2017-06-14 02:51:09,2017-06-14 02:56:41,87
CALLER:,can you come in please come in come in come in come on come on close the door please did you close that door,none,GTIRT17-00675,2017-06-14 02:51:09,2017-06-14 02:56:41,87
OPERATOR:,hello,none,GTIRT17-00675,2017-06-14 02:51:09,2017-06-14 02:56:41,87
CALLER:,hello hello inaudible,none,GTIRT17-00675,2017-06-14 02:51:09,2017-06-14 02:56:41,87
OPERATOR:,hello did someone try to go outside,none,GTIRT17-00675,2017-06-14 02:51:09,2017-06-14 02:56:41,87
CALLER:,yeah yeah,none,GTIRT17-00675,2017-06-14 02:51:09,2017-06-14 02:56:41,87
OPERATOR:,okay and what happened what s it like,none,GTIRT17-00675,2017-06-14 02:51:09,2017-06-14 02:56:41,87
CALLER:,someone s knocking on the door,People,GTIRT17-00675,2017-06-14 02:51:09,2017-06-14 02:56:41,87
OPERATOR:,sorry,none,GTIRT17-00675,2017-06-14 02:51:09,2017-06-14 02:56:41,87
CALLER:,someone s knocking on the door inaudible,People,GTIRT17-00675,2017-06-14 02:51:09,2017-06-14 02:56:41,87
OPERATOR:,did you say someone s knocking at the door or it s hot hello,none,GTIRT17-00675,2017-06-14 02:51:09,2017-06-14 02:56:41,87
CALLER:,inaudible,none,GTIRT17-00675,2017-06-14 02:51:09,2017-06-14 02:56:41,87
OPERATOR:,hello,none,GTIRT17-00675,2017-06-14 02:51:09,2017-06-14 02:56:41,87
CALLER:,close the door quick inaudible,none,GTIRT17-00675,2017-06-14 02:51:09,2017-06-14 02:56:41,87
OPERATOR:,hello,none,GTIRT17-00675,2017-06-14 02:51:09,2017-06-14 02:56:41,87
CALLER:,close the door,none,GTIRT17-00675,2017-06-14 02:51:09,2017-06-14 02:56:41,87
OPERATOR:,hello hello hello,none,GTIRT17-00675,2017-06-14 02:51:09,2017-06-14 02:56:41,87
CALLER:,inaudible,none,GTIRT17-00675,2017-06-14 02:51:09,2017-06-14 02:56:41,87
OPERATOR:,hello are you still there,none,GTIRT17-00675,2017-06-14 02:51:09,2017-06-14 02:56:41,87
CALLER:,we need yeah we are on the inaudible seccond floor overspeaking,Floor,GTIRT17-00675,2017-06-14 02:51:09,2017-06-14 02:56:41,87
OPERATOR:,tell me what s going on explain to me what s happening,none,GTIRT17-00675,2017-06-14 02:51:09,2017-06-14 02:56:41,87
CALLER:,so it s very smoky in the room and everyone is panicking,Smoke,GTIRT17-00675,2017-06-14 02:51:09,2017-06-14 02:56:41,87
OPERATOR:,how many people have you got in there with you,People,GTIRT17-00675,2017-06-14 02:51:09,2017-06-14 02:56:41,87
CALLER:,about ten,People,GTIRT17-00675,2017-06-14 02:51:09,2017-06-14 02:56:41,87
OPERATOR:,ten of you so there s ten people and you re in flat one hundred ninety three did you say,Floor,GTIRT17-00675,2017-06-14 02:51:09,2017-06-14 02:56:41,87
CALLER:,yeah so from the seccond floor from the top it s the seccond highest floor,Floor,GTIRT17-00675,2017-06-14 02:51:09,2017-06-14 02:56:41,87
OPERATOR:,you re the sec you re flat you re on floor twenty two,Flat,GTIRT17-00675,2017-06-14 02:51:09,2017-06-14 02:56:41,87
CALLER:,twenty two yes,Flat,GTIRT17-00675,2017-06-14 02:51:09,2017-06-14 02:56:41,87
OPERATOR:,twenty two okay so you ve gotten people you said,Flat,GTIRT17-00675,2017-06-14 02:51:09,2017-06-14 02:56:41,87
CALLER:,yes,none,GTIRT17-00675,2017-06-14 02:51:09,2017-06-14 02:56:41,87
OPERATOR:,okay so where is everyone at the moment are they in a room or in the front room in the flat,none,GTIRT17-00675,2017-06-14 02:51:09,2017-06-14 02:56:41,87
CALLER:,we are in the living room inaudible in the living room at the corner,none,GTIRT17-00675,2017-06-14 02:51:09,2017-06-14 02:56:41,87
OPERATOR:,all in the living room corner,none,GTIRT17-00675,2017-06-14 02:51:09,2017-06-14 02:56:41,87
CALLER:,yes,none,GTIRT17-00675,2017-06-14 02:51:09,2017-06-14 02:56:41,87
OPERATOR:,okay and you ve gotten of you you said so are there any flames,Fire,GTIRT17-00675,2017-06-14 02:51:09,2017-06-14 02:56:41,87
CALLER:,any what,none,GTIRT17-00675,2017-06-14 02:51:09,2017-06-14 02:56:41,87
OPERATOR:,any flames fire,Fire,GTIRT17-00675,2017-06-14 02:51:09,2017-06-14 02:56:41,87
CALLER:,no it s very smoky,none,GTIRT17-00675,2017-06-14 02:51:09,2017-06-14 02:56:41,87
OPERATOR:,just the smoke,Smoke,GTIRT17-00675,2017-06-14 02:51:09,2017-06-14 02:56:41,87
CALLER:,inaudible don t inaudible open the window open the door please,Smoke,GTIRT17-00675,2017-06-14 02:51:09,2017-06-14 02:56:41,87
OPERATOR:,okay,none,GTIRT17-00675,2017-06-14 02:51:09,2017-06-14 02:56:41,87
CALLER:,can you tell us what to do please hello hello are you still there,none,GTIRT17-00675,2017-06-14 02:51:09,2017-06-14 02:56:41,87
OPERATOR:,okay hello you still there,none,GTIRT17-00675,2017-06-14 02:51:09,2017-06-14 02:56:41,87
CALLER:,yes,none,GTIRT17-00675,2017-06-14 02:51:09,2017-06-14 02:56:41,87
OPERATOR:,okay listen to me you said there s ten people in there can you find blankets or towel in in the flat,none,GTIRT17-00675,2017-06-14 02:51:09,2017-06-14 02:56:41,87
CALLER:,can you what,none,GTIRT17-00675,2017-06-14 02:51:09,2017-06-14 02:56:41,87
OPERATOR:,can you find blankets or towels inside there,none,GTIRT17-00675,2017-06-14 02:51:09,2017-06-14 02:56:41,87
CALLER:,yes,none,GTIRT17-00675,2017-06-14 02:51:09,2017-06-14 02:56:41,87
OPERATOR:,yeah get get as many as you can try and get one per person,none,GTIRT17-00675,2017-06-14 02:51:09,2017-06-14 02:56:41,87
CALLER:,so what do you mean,none,GTIRT17-00675,2017-06-14 02:51:09,2017-06-14 02:56:41,87
OPERATOR:,get as many towels and blankets as you can yeah one per person and you need to make them wet get to the tap a bath a sink soak them wake them all wet,none,GTIRT17-00675,2017-06-14 02:51:09,2017-06-14 02:56:41,87
CALLER:,yeah and then,none,GTIRT17-00675,2017-06-14 02:51:09,2017-06-14 02:56:41,87
OPERATOR:,okay and then when you ve done that get everyone one per person wrap them cover them selves up make sure their head s they cover them selves yeah and try and leave the building okay there s a lot of people inside and the firefighters are struggling to get to everyone okay so your best bet is to try and make your way out the building,none,GTIRT17-00675,2017-06-14 02:51:09,2017-06-14 02:56:41,87
CALLER:,but we are on twenty second floor overspeaking downstairs,Floor,GTIRT17-00675,2017-06-14 02:51:09,2017-06-14 02:56:41,87
OPERATOR:,twenty second floor i know i know but your best bet is to try and get out there there s a lot of smoke coming in and the smoke is very dangerous okay,Floor,GTIRT17-00675,2017-06-14 02:51:09,2017-06-14 02:56:41,87
CALLER:,so what do you want you want us to go,none,GTIRT17-00675,2017-06-14 02:51:09,2017-06-14 02:56:41,87
OPERATOR:,okay your your best bet is to try and leave get outside okay,none,GTIRT17-00675,2017-06-14 02:51:09,2017-06-14 02:56:41,87
CALLER:,so can you inaudible,none,GTIRT17-00675,2017-06-14 02:51:09,2017-06-14 02:56:41,87
OPERATOR:,are you going to try and do that now can you the other people in there with you hello hello hello hello are you still there hello,none,GTIRT17-00675,2017-06-14 02:51:09,2017-06-14 02:56:41,87
OPERATOR:,hi inaudible can i help,none,GTIRT17-00675,2017-06-14 02:51:09,2017-06-14 02:56:41,87
OPERATOR:,okay thanks thanks i ll clear the line thanks bye,none,GTIRT17-00675,2017-06-14 02:51:09,2017-06-14 02:56:41,87
OPERATOR:,fire brigade hello,none,GTIRT17-00680,2017-06-14 02:55:59,2017-06-14 02:58:37,29
CALLER:,hello there s a fire inaudible help inaudible crying,Fire,GTIRT17-00680,2017-06-14 02:55:59,2017-06-14 02:58:37,29
OPERATOR:,hello,none,GTIRT17-00680,2017-06-14 02:55:59,2017-06-14 02:58:37,29
CALLER:,it s on fire screaming,Fire,GTIRT17-00680,2017-06-14 02:55:59,2017-06-14 02:58:37,29
CALLER:,twenty second floor please can you send inaudible helicopter inaudible helicopter to twenty second floor inaudible the light is on our light is on please send it because the fire is everywhere,Fire,GTIRT17-00680,2017-06-14 02:55:59,2017-06-14 02:58:37,29
CALLER:,inaudible,none,GTIRT17-00680,2017-06-14 02:55:59,2017-06-14 02:58:37,29
OPERATOR:,overspeaking for a second here okay,none,GTIRT17-00680,2017-06-14 02:55:59,2017-06-14 02:58:37,29
CALLER:,please,none,GTIRT17-00680,2017-06-14 02:55:59,2017-06-14 02:58:37,29
OPERATOR:,you need to cover everybody s faces with wet towels wet tea table cloths overspeaking,none,GTIRT17-00680,2017-06-14 02:55:59,2017-06-14 02:58:37,29
CALLER:,we have already have it we have it but now we can t even see each other because the smoke is too heavy please send us a helicopter,Smoke,GTIRT17-00680,2017-06-14 02:55:59,2017-06-14 02:58:37,29
OPERATOR:,right overspeaking okay you need to overspeaking,none,GTIRT17-00680,2017-06-14 02:55:59,2017-06-14 02:58:37,29
CALLER:,we have the wet towel,none,GTIRT17-00680,2017-06-14 02:55:59,2017-06-14 02:58:37,29
OPERATOR:,faces with wet towels wet cloths anything you can find and get,none,GTIRT17-00680,2017-06-14 02:55:59,2017-06-14 02:58:37,29
CALLER:,yes we have wet towels yes,none,GTIRT17-00680,2017-06-14 02:55:59,2017-06-14 02:58:37,29
OPERATOR:,to the stairwell,none,GTIRT17-00680,2017-06-14 02:55:59,2017-06-14 02:58:37,29
CALLER:,yes yes we all have it yes we all have it but now the fire is just next to us the fire is the fire is just next to us the room next to us,Fire,GTIRT17-00680,2017-06-14 02:55:59,2017-06-14 02:58:37,29
OPERATOR:,right are you on the stairwell,none,GTIRT17-00680,2017-06-14 02:55:59,2017-06-14 02:58:37,29
CALLER:,oh shit the fire is now,Fire,GTIRT17-00680,2017-06-14 02:55:59,2017-06-14 02:58:37,29
OPERATOR:,overspeaking everybody s face get to the stairwell that is your only inaudible,none,GTIRT17-00680,2017-06-14 02:55:59,2017-06-14 02:58:37,29
CALLER:,we have already had that but now the fire inaudible begging you or we ll or we ll die here,Fire,GTIRT17-00680,2017-06-14 02:55:59,2017-06-14 02:58:37,29
OPERATOR:,where exactly are you,none,GTIRT17-00680,2017-06-14 02:55:59,2017-06-14 02:58:37,29
CALLER:,the fire is everywhere,Fire,GTIRT17-00680,2017-06-14 02:55:59,2017-06-14 02:58:37,29
OPERATOR:,yeah i know the fire is everywhere inaudible to the stairwell and make your way downstairs as quick as you can,none,GTIRT17-00680,2017-06-14 02:55:59,2017-06-14 02:58:37,29
CALLER:,are you sure we are on twenty second floor we are going downstairs,none,GTIRT17-00680,2017-06-14 02:55:59,2017-06-14 02:58:37,29
OPERATOR:,yeah that is what inaudible,none,GTIRT17-00680,2017-06-14 02:55:59,2017-06-14 02:58:37,29
CALLER:,inaudible,none,GTIRT17-00680,2017-06-14 02:55:59,2017-06-14 02:58:37,29
OPERATOR:,overspeaking for a second here okay it s a very bad fire okay your only chance of surviving that fire is to get to the stairwell okay you need to put wet cloths around your face and get to the stairwell,Fire,GTIRT17-00680,2017-06-14 02:55:59,2017-06-14 02:58:37,29
CALLER:,okay okay okay inaudible bye,none,GTIRT17-00680,2017-06-14 02:55:59,2017-06-14 02:58:37,29
OPERATOR:,do that now,none,GTIRT17-00680,2017-06-14 02:55:59,2017-06-14 02:58:37,29
OPERATOR:,fire brigade,none,GTIRT17-00686,2017-06-14 02:55:38,2017-06-14 02:56:55,24
CALLER:,hello i m calling from one hundred eighty three we can t get out,Flat,GTIRT17-00686,2017-06-14 02:55:38,2017-06-14 02:56:55,24
OPERATOR:,hello fire brigade,none,GTIRT17-00686,2017-06-14 02:55:38,2017-06-14 02:56:55,24
CALLER:,hello i m calling from one hundred eighty three grenfell tower we can t get out,Flat,GTIRT17-00686,2017-06-14 02:55:38,2017-06-14 02:56:55,24
OPERATOR:,okay have you are you able to get some wet towels put them over your head and try and get out,none,GTIRT17-00686,2017-06-14 02:55:38,2017-06-14 02:56:55,24
CALLER:,i ve tried that we can t we can t get out,none,GTIRT17-00686,2017-06-14 02:55:38,2017-06-14 02:56:55,24
OPERATOR:,you can t where are where are you,Flat,GTIRT17-00686,2017-06-14 02:55:38,2017-06-14 02:56:55,24
CALLER:,one hundred eighty three twentyfirst floor,Flat,GTIRT17-00686,2017-06-14 02:55:38,2017-06-14 02:56:55,24
OPERATOR:,one hundred eighty three and you can t get out at all,Flat,GTIRT17-00686,2017-06-14 02:55:38,2017-06-14 02:56:55,24
CALLER:,we can t can t get out at all inaudible,none,GTIRT17-00686,2017-06-14 02:55:38,2017-06-14 02:56:55,24
OPERATOR:,what if you put you you wouldn t be able to leave the bui like leave your flat,none,GTIRT17-00686,2017-06-14 02:55:38,2017-06-14 02:56:55,24
CALLER:,no we can t leave our flat at the moment,none,GTIRT17-00686,2017-06-14 02:55:38,2017-06-14 02:56:55,24
OPERATOR:,no okay are you able to block up with the smoke coming in,none,GTIRT17-00686,2017-06-14 02:55:38,2017-06-14 02:56:55,24
CALLER:,i ve tried with towels but it s still coming in and the fire is right next door,Fire,GTIRT17-00686,2017-06-14 02:55:38,2017-06-14 02:56:55,24
OPERATOR:,have you got a side to your flat where it s got any fresh air,none,GTIRT17-00686,2017-06-14 02:55:38,2017-06-14 02:56:55,24
CALLER:,yeah,none,GTIRT17-00686,2017-06-14 02:55:38,2017-06-14 02:56:55,24
OPERATOR:,yeah can you get over to that side of the flat where the fresh air is open the window there,none,GTIRT17-00686,2017-06-14 02:55:38,2017-06-14 02:56:55,24
CALLER:,that s where we are i ve opened the window,none,GTIRT17-00686,2017-06-14 02:55:38,2017-06-14 02:56:55,24
OPERATOR:,yeah okay so what floor did you say you were flat,Flat,GTIRT17-00686,2017-06-14 02:55:38,2017-06-14 02:56:55,24
CALLER:,twentyfirst floor flat one hundred eighty three,Flat,GTIRT17-00686,2017-06-14 02:55:38,2017-06-14 02:56:55,24
OPERATOR:,one hundred eighty three okay i ll let the firemen know okay to come up to you,Flat,GTIRT17-00686,2017-06-14 02:55:38,2017-06-14 02:56:55,24
CALLER:,yeah three three kids and three adults and one heavily pregnant wife,People,GTIRT17-00686,2017-06-14 02:55:38,2017-06-14 02:56:55,24
OPERATOR:,three to six of you and a pregnant lady okay i ll let them know,People,GTIRT17-00686,2017-06-14 02:55:38,2017-06-14 02:56:55,24
CALLER:,thank you thank you,none,GTIRT17-00686,2017-06-14 02:55:38,2017-06-14 02:56:55,24
OPERATOR:,fire brigade,none,GTIRT17-00688,2017-06-14 02:58:42,2017-06-14 03:00:38,48
CALLER:,yeah this is inaudible i ve got someone on the twenty third floor,Floor,GTIRT17-00688,2017-06-14 02:58:42,2017-06-14 03:00:38,48
OPERATOR:,say that again,none,GTIRT17-00688,2017-06-14 02:58:42,2017-06-14 03:00:38,48
CALLER:,twenty third floor twenty third floor inaudible,Floor,GTIRT17-00688,2017-06-14 02:58:42,2017-06-14 03:00:38,48
OPERATOR:,tw twenty third floor is this on grenfell towers,Floor,GTIRT17-00688,2017-06-14 02:58:42,2017-06-14 03:00:38,48
CALLER:,yeah yes,none,GTIRT17-00688,2017-06-14 02:58:42,2017-06-14 03:00:38,48
OPERATOR:,okay and urn what s happening in your flat inaudible flat,none,GTIRT17-00688,2017-06-14 02:58:42,2017-06-14 03:00:38,48
CALLER:,i m not i m not in the flat she s in the flat i m outside,none,GTIRT17-00688,2017-06-14 02:58:42,2017-06-14 03:00:38,48
OPERATOR:,okay so what flat is she in,none,GTIRT17-00688,2017-06-14 02:58:42,2017-06-14 03:00:38,48
CALLER:,um two hundred three,Flat,GTIRT17-00688,2017-06-14 02:58:42,2017-06-14 03:00:38,48
OPERATOR:,two hundred three,none,GTIRT17-00688,2017-06-14 02:58:42,2017-06-14 03:00:38,48
CALLER:,yeah,none,GTIRT17-00688,2017-06-14 02:58:42,2017-06-14 03:00:38,48
OPERATOR:,right so you re on her side and what are you,none,GTIRT17-00688,2017-06-14 02:58:42,2017-06-14 03:00:38,48
CALLER:,yeah,none,GTIRT17-00688,2017-06-14 02:58:42,2017-06-14 03:00:38,48
OPERATOR:,trying to get her out are you,none,GTIRT17-00688,2017-06-14 02:58:42,2017-06-14 03:00:38,48
CALLER:,no but the police won t let me in they said i have to call nine nine nine,none,GTIRT17-00688,2017-06-14 02:58:42,2017-06-14 03:00:38,48
OPERATOR:,okay so you re on the twentyfirst floor you re making,Floor,GTIRT17-00688,2017-06-14 02:58:42,2017-06-14 03:00:38,48
CALLER:,no no no,none,GTIRT17-00688,2017-06-14 02:58:42,2017-06-14 03:00:38,48
OPERATOR:,your way outside are you,none,GTIRT17-00688,2017-06-14 02:58:42,2017-06-14 03:00:38,48
